{
  "$schema": "https://json-schema.org/draft/2020-12/schema",
  "$id": "https://schemas.oneclick2d.invalid/gate-f-model-motion-draft/v0.2/config.schema.json",
  "title": "OneClick2D Gate F Model Motion Draft Config v0.2",
  "type": "object",
  "additionalProperties": false,
  "required": ["format", "format_version", "profile_id", "required_model_profile_id", "required_pillow_version", "frame_sequence"],
  "properties": {
    "format": {"const": "oneclick2d.model-motion-draft-config"},
    "format_version": {"const": "0.2.0"},
    "profile_id": {"const": "oc2d.spike.model-motion-draft.affine-semantic.v14"},
    "required_model_profile_id": {"const": "see-through.v3.nf4.1280.wsl2.source-preserve.v5"},
    "required_pillow_version": {"const": "12.1.0"},
    "frame_sequence": {"$ref": "../../gate-f-frame-sequence/v0.1/config.schema.json"}
  }
}
